{
  "readiness_version": "AR-P003-v0.3-freeze-readiness-v0.1",
  "protocol_version": "v0.3-draft-2026-09-20-three-condition-v0.1",
  "study_status": "development_not_ready",
  "gates": {
    "comparison_conditions": {
      "status": "complete",
      "evidence_refs": [
        "docs/AR-P003-V0.3-COMPARISON-CONDITIONS-DECISION-2026-09-20.md",
        "benchmark/arp003_v0_3/methodology-decisions.current.json",
        "benchmark/arp003_v0_3/protocol.json",
        "benchmark/arp003_v0_3/generate_assignment.py",
        "benchmark/arp003_v0_3/case-package.schema.json",
        "benchmark/arp003_v0_3/lint_case_packages.py",
        "benchmark/arp003_v0_3/runner-bundle.schema.json",
        "benchmark/arp003_v0_3/runner-response.schema.json",
        "benchmark/arp003_v0_3/runner-analysis.schema.json",
        "benchmark/arp003_v0_3/build_runner_bundles.py",
        "benchmark/arp003_v0_3/offline_runner.html",
        "benchmark/arp003_v0_3/merge_runner_responses.py",
        "benchmark/arp003_v0_3/score_responses.py",
        "benchmark/arp003_v0_3/plan_crossed_design.py",
        "benchmark/arp003_v0_3/audit_leakage.py"
      ],
      "notes": "Owner selected three_condition_structured_control on 2026-09-20. The development pipeline now requires raw, neutral structured-control, and Receipt conditions over the same underlying evidence, with versioned assignment/runner/scoring contracts and an explicit structured-control evidence-symmetry audit. This completes only the comparison-condition design gate; the study remains development-only, not frozen, and not executed."
    },
    "reviewer_population": {
      "status": "pending",
      "evidence_refs": [
        "docs/AR-P003-V0.3-PROTOCOL.md",
        "benchmark/arp003_v0_3/methodology-decisions.current.json"
      ],
      "notes": "Target reviewer population and eligibility/exclusion criteria are not frozen."
    },
    "primary_endpoints": {
      "status": "prepared",
      "evidence_refs": [
        "docs/AR-P003-V0.3-PROTOCOL.md",
        "benchmark/arp003_v0_3/response-record.schema.json",
        "benchmark/arp003_v0_3/methodology-decisions.current.json"
      ],
      "notes": "Candidate component endpoints exist, but the confirmatory primary endpoint or small prespecified primary set is not frozen."
    },
    "effect_or_precision_target": {
      "status": "pending",
      "evidence_refs": [
        "docs/AR-P003-V0.3-PLANNING.md",
        "benchmark/arp003_v0_3/methodology-decisions.current.json"
      ],
      "notes": "No minimally meaningful effect or final precision target has been selected."
    },
    "crossed_design_power": {
      "status": "prepared",
      "evidence_refs": [
        "benchmark/arp003_v0_3/plan_sample_size.py",
        "benchmark/arp003_v0_3/plan_crossed_design.py",
        "benchmark/arp003_v0_3/crossed-planning-scenarios.example.json",
        "docs/AR-P003-V0.3-PLANNING.md",
        "docs/AR-P003-V0.3-CROSSED-PLANNING.md"
      ],
      "notes": "Design-specific reviewer × case simulation tooling now exists and uses the balanced assignment plus two-way reviewer/case cluster-robust covariance. The gate remains prepared, not complete: primary endpoint/effect target and variance assumptions are not frozen."
    },
    "sample_allocation_stopping": {
      "status": "pending",
      "evidence_refs": [
        "docs/AR-P003-V0.3-PROTOCOL.md"
      ],
      "notes": "Reviewer count, case count, cases per reviewer, allocation, and stopping rule are not frozen."
    },
    "sealed_corpus": {
      "status": "pending",
      "evidence_refs": [
        "benchmark/arp003_v0_3/case-package.schema.json",
        "benchmark/arp003_v0_3/lint_case_packages.py"
      ],
      "notes": "Development corpus tooling exists; no fresh sealed confirmatory corpus has been created."
    },
    "leakage_validation": {
      "status": "prepared",
      "evidence_refs": [
        "benchmark/arp003_v0_3/lint_case_packages.py",
        "docs/AR-P003-V0.3-PROTOCOL.md",
        "benchmark/arp003_v0_3/audit_leakage.py",
        "benchmark/arp003_v0_3/leakage-audit.schema.json",
        "benchmark/arp003_v0_3/build_runner_bundles.py",
        "docs/AR-P003-V0.3-LEAKAGE-AUDIT.md",
        "benchmark/arp003_v0_3/case-methodology-review.schema.json",
        "benchmark/arp003_v0_3/case-methodology-review.example.json",
        "benchmark/arp003_v0_3/validate_case_methodology_review.py"
      ],
      "notes": "Mechanical package checks, a leakage/presentation audit, and a bound manual case-methodology review record/validator now exist. A complete manual review must bind to the exact leakage-audit report/build hash, cover every audited case, contain no unresolved automated high-risk flags, and mark semantic leakage, realism, framing neutrality, and answer-option quality acceptable. The checked-in review is a not-run template; the gate remains prepared until the final sealed corpus is audited and manually reviewed."
    },
    "challenge_strata": {
      "status": "prepared",
      "evidence_refs": [
        "docs/AR-P003-V0.3-PROTOCOL.md",
        "benchmark/arp003_v0_3/runner-analysis.schema.json",
        "benchmark/arp003_v0_3/methodology-decisions.current.json"
      ],
      "notes": "Stale, incomplete, and conflicting Receipt strata are specified but no final sealed case counts are frozen."
    },
    "browser_smoke": {
      "status": "pending",
      "evidence_refs": [
        "docs/AR-P003-V0.3-OFFLINE-RUNNER.md"
      ],
      "notes": "Automated/static runner checks pass, but real browser/device/accessibility smoke testing remains open."
    },
    "reviewer_instructions": {
      "status": "prepared",
      "evidence_refs": [
        "docs/AR-P003-V0.3-REVIEWER-INSTRUCTIONS-DRAFT.md"
      ],
      "notes": "Neutral reviewer instructions exist as a draft and are not frozen."
    },
    "assignment": {
      "status": "prepared",
      "evidence_refs": [
        "benchmark/arp003_v0_3/generate_assignment.py",
        "benchmark/arp003_v0_3/build_runner_bundles.py"
      ],
      "notes": "Balanced seeded assignment tooling exists; final seed/config/order are not frozen."
    },
    "timing_exclusions": {
      "status": "prepared",
      "evidence_refs": [
        "docs/AR-P003-V0.3-OFFLINE-RUNNER.md",
        "benchmark/arp003_v0_3/runner-response.schema.json",
        "benchmark/arp003_v0_3/methodology-decisions.current.json"
      ],
      "notes": "Wall/active instrumentation exists; primary timing definition and technical-exclusion rules are not frozen."
    },
    "scorer_analysis_plan": {
      "status": "prepared",
      "evidence_refs": [
        "benchmark/arp003_v0_3/score_responses.py",
        "docs/AR-P003-V0.3-PROTOCOL.md"
      ],
      "notes": "Component scorer exists; final statistical analysis handling reviewer/case dependence is not frozen."
    },
    "ethics_determination": {
      "status": "pending",
      "evidence_refs": [],
      "notes": "No ethics/REB/IRB review or documented determination has been recorded."
    },
    "freeze_manifest": {
      "status": "prepared",
      "evidence_refs": [
        "benchmark/arp003_v0_3/freeze_manifest.py",
        "benchmark/arp003_v0_3/freeze-manifest.schema.json"
      ],
      "notes": "Freeze-manifest v0.2 tooling now binds the exact protocol path/version/SHA-256, records whether the protocol is frozen, rejects duplicate artifact paths, computes an aggregate artifact-set SHA-256 and deterministic freeze_content_id, and can fail closed unless protocol.frozen=true. The gate remains prepared: no final confirmatory freeze manifest can exist until all preceding gates are resolved and the actual frozen artifacts are supplied."
    }
  }
}
